,favorite_count,favorited,full_text,tweet_id,retweet_count,retweeted,Unnamed: 0,retweeted_status_id,retweeted_status_user_id,retweeted_status_timestamp,expanded_urls,rating_numerator,rating_denominator,name,dog_stage,jpg_url,img_num,p1,p1_conf,p1_dog,p2,p2_conf,p2_dog,p3,p3_conf,p3_dog
0,34634,False,This is Phineas. He's a mystical boy. Only ever appears in the hole of a donut. 13/10 https://t.co/MgUWQ76dJU,892420643555336193,7217,False,0,,,,https://twitter.com/dog_rates/status/892420643555336193/photo/1,13,10,Phineas,,https://pbs.twimg.com/media/DGKD1-bXoAAIAUK.jpg,1,orange,0.09704860000000001,False,bagel,0.08585110000000001,False,banana,0.07611,False
1,30006,False,"This is Tilly. She's just checking pup on you. Hopes you're doing ok. If not, she's available for pats, snugs, boops, the whole bit. 13/10 https://t.co/0Xxu71qeIV",892177421306343426,5413,False,1,,,,https://twitter.com/dog_rates/status/892177421306343426/photo/1,13,10,Tilly,,https://pbs.twimg.com/media/DGGmoV4XsAAUL6n.jpg,1,chihuahua,0.323581,True,pekinese,0.0906465,True,papillon,0.0689569,True
2,22592,False,This is Archie. He is a rare Norwegian Pouncing Corgo. Lives in the tall grass. You never know when one may strike. 12/10 https://t.co/wUnZnhtVJB,891815181378084864,3576,False,2,,,,https://twitter.com/dog_rates/status/891815181378084864/photo/1,12,10,Archie,,https://pbs.twimg.com/media/DGBdLU1WsAANxJ9.jpg,1,chihuahua,0.716012,True,malamute,0.078253,True,kelpie,0.0313789,True
3,37891,False,This is Darla. She commenced a snooze mid meal. 13/10 happens to the best of us https://t.co/tD36da7qLQ,891689557279858688,7438,False,3,,,,https://twitter.com/dog_rates/status/891689557279858688/photo/1,13,10,Darla,,https://pbs.twimg.com/media/DF_q7IAWsAEuuN8.jpg,1,paper_towel,0.17027799999999998,False,labrador_retriever,0.16808599999999999,True,spatula,0.0408359,False
4,36179,False,"This is Franklin. He would like you to stop calling him ""cute."" He is a very fierce shark and should be respected as such. 12/10 #BarkWeek https://t.co/AtUZn91f7f",891327558926688256,7982,False,4,,,,"https://twitter.com/dog_rates/status/891327558926688256/photo/1,https://twitter.com/dog_rates/status/891327558926688256/photo/1",12,10,Franklin,,https://pbs.twimg.com/media/DF6hr6BUMAAzZgT.jpg,2,basset,0.555712,True,english_springer,0.22576999999999997,True,german_short-haired_pointer,0.175219,True
5,18246,False,Here we have a majestic great white breaching off South Africa's coast. Absolutely h*ckin breathtaking. 13/10 (IG: tucker_marlo) #BarkWeek https://t.co/kQ04fDDRmh,891087950875897856,2680,False,5,,,,https://twitter.com/dog_rates/status/891087950875897856/photo/1,13,10,None,,https://pbs.twimg.com/media/DF3HwyEWsAABqE6.jpg,1,chesapeake_bay_retriever,0.425595,True,irish_terrier,0.116317,True,indian_elephant,0.07690219999999999,False
6,10621,False,"Meet Jax. He enjoys ice cream so much he gets nervous around it. 13/10 help Jax enjoy more things by clicking below

https://t.co/Zr4hWfAs1H https://t.co/tVJBRMnhxl",890971913173991426,1723,False,6,,,,"https://gofundme.com/ydvmve-surgery-for-jax,https://twitter.com/dog_rates/status/890971913173991426/photo/1",13,10,Jax,,https://pbs.twimg.com/media/DF1eOmZXUAALUcq.jpg,1,appenzeller,0.34170300000000003,True,border_collie,0.199287,True,ice_lolly,0.193548,False
7,58291,False,When you watch your owner call another dog a good boy but then they turn back to you and say you're a great boy. 13/10 https://t.co/v0nONBcwxq,890729181411237888,16251,False,7,,,,"https://twitter.com/dog_rates/status/890729181411237888/photo/1,https://twitter.com/dog_rates/status/890729181411237888/photo/1",13,10,None,,https://pbs.twimg.com/media/DFyBahAVwAAhUTd.jpg,2,pomeranian,0.566142,True,eskimo_dog,0.17840599999999998,True,pembroke,0.0765069,True
8,25120,False,This is Zoey. She doesn't want to be one of the scary sharks. Just wants to be a snuggly pettable boatpet. 13/10 #BarkWeek https://t.co/9TwLuAGH0b,890609185150312448,3721,False,8,,,,https://twitter.com/dog_rates/status/890609185150312448/photo/1,13,10,Zoey,,https://pbs.twimg.com/media/DFwUU__XcAEpyXI.jpg,1,irish_terrier,0.48757399999999995,True,irish_setter,0.193054,True,chesapeake_bay_retriever,0.118184,True
9,28638,False,This is Cassie. She is a college pup. Studying international doggo communication and stick theory. 14/10 so elegant much sophisticate https://t.co/t1bfwz5S2A,890240255349198849,6276,False,9,,,,https://twitter.com/dog_rates/status/890240255349198849/photo/1,14,10,Cassie,doggo,https://pbs.twimg.com/media/DFrEyVuW0AAO3t9.jpg,1,pembroke,0.511319,True,cardigan,0.451038,True,chihuahua,0.029248200000000002,True
10,27675,False,This is Koda. He is a South Australian deckshark. Deceptively deadly. Frighteningly majestic. 13/10 would risk a petting #BarkWeek https://t.co/dVPW0B0Mme,890006608113172480,6320,False,10,,,,"https://twitter.com/dog_rates/status/890006608113172480/photo/1,https://twitter.com/dog_rates/status/890006608113172480/photo/1",13,10,Koda,,https://pbs.twimg.com/media/DFnwSY4WAAAMliS.jpg,1,samoyed,0.9579790000000001,True,pomeranian,0.0138835,True,chow,0.00816748,True
11,25147,False,This is Bruno. He is a service shark. Only gets out of the water to assist you. 13/10 terrifyingly good boy https://t.co/u1XPQMl29g,889880896479866881,4293,False,11,,,,https://twitter.com/dog_rates/status/889880896479866881/photo/1,13,10,Bruno,,https://pbs.twimg.com/media/DFl99B1WsAITKsg.jpg,1,french_bulldog,0.377417,True,labrador_retriever,0.151317,True,muzzle,0.0829811,False
12,43111,False,Here's a puppo that seems to be on the fence about something haha no but seriously someone help her. 13/10 https://t.co/BxvuXk0UCm,889665388333682689,8595,False,12,,,,https://twitter.com/dog_rates/status/889665388333682689/photo/1,13,10,None,puppo,https://pbs.twimg.com/media/DFi579UWsAAatzw.jpg,1,pembroke,0.966327,True,cardigan,0.0273557,True,basenji,0.00463323,True
13,24243,False,This is Ted. He does his best. Sometimes that's not enough. But it's ok. 12/10 would assist https://t.co/f8dEDcrKSR,889638837579907072,3840,False,13,,,,"https://twitter.com/dog_rates/status/889638837579907072/photo/1,https://twitter.com/dog_rates/status/889638837579907072/photo/1",12,10,Ted,,https://pbs.twimg.com/media/DFihzFfXsAYGDPR.jpg,1,french_bulldog,0.99165,True,boxer,0.00212864,True,staffordshire_bullterrier,0.00149818,True
14,13662,False,This is Stuart. He's sporting his favorite fanny pack. Secretly filled with bones only. 13/10 puppared puppo #BarkWeek https://t.co/y70o6h3isq,889531135344209921,1934,False,14,,,,https://twitter.com/dog_rates/status/889531135344209921/photo/1,13,10,Stuart,puppo,https://pbs.twimg.com/media/DFg_2PVW0AEHN3p.jpg,1,golden_retriever,0.953442,True,labrador_retriever,0.0138341,True,redbone,0.00795775,True
15,22649,False,This is Oliver. You're witnessing one of his many brutal attacks. Seems to be playing with his victim. 13/10 fr*ckin frightening #BarkWeek https://t.co/WpHvrQedPb,889278841981685760,4578,False,15,,,,https://twitter.com/dog_rates/status/889278841981685760/video/1,13,10,Oliver,,https://pbs.twimg.com/ext_tw_video_thumb/889278779352338437/pu/img/VlbFB3v8H8VwzVNY.jpg,1,whippet,0.626152,True,borzoi,0.194742,True,saluki,0.027350700000000002,True
16,26225,False,This is Jim. He found a fren. Taught him how to sit like the good boys. 12/10 for both https://t.co/chxruIOUJN,888917238123831296,3861,False,16,,,,https://twitter.com/dog_rates/status/888917238123831296/photo/1,12,10,Jim,,https://pbs.twimg.com/media/DFYRgsOUQAARGhO.jpg,1,golden_retriever,0.714719,True,tibetan_mastiff,0.12018399999999999,True,labrador_retriever,0.10550599999999999,True
17,23003,False,This is Zeke. He has a new stick. Very proud of it. Would like you to throw it for him without taking it. 13/10 would do my best https://t.co/HTQ77yNQ5K,888804989199671297,3645,False,17,,,,"https://twitter.com/dog_rates/status/888804989199671297/photo/1,https://twitter.com/dog_rates/status/888804989199671297/photo/1",13,10,Zeke,,https://pbs.twimg.com/media/DFWra-3VYAA2piG.jpg,1,golden_retriever,0.46976,True,labrador_retriever,0.184172,True,english_setter,0.0734817,True
18,17751,False,This is Ralphus. He's powering up. Attempting maximum borkdrive. 13/10 inspirational af https://t.co/YnYAFCTTiK,888554962724278272,2963,False,18,,,,"https://twitter.com/dog_rates/status/888554962724278272/photo/1,https://twitter.com/dog_rates/status/888554962724278272/photo/1,https://twitter.com/dog_rates/status/888554962724278272/photo/1,https://twitter.com/dog_rates/status/888554962724278272/photo/1",13,10,Ralphus,,https://pbs.twimg.com/media/DFTH_O-UQAACu20.jpg,3,siberian_husky,0.700377,True,eskimo_dog,0.166511,True,malamute,0.111411,True
19,19605,False,This is Gerald. He was just told he didn't get the job he interviewed for. A h*ckin injustice. 12/10 didn't want the job anyway https://t.co/DK7iDPfuRX,888078434458587136,2983,False,20,,,,"https://twitter.com/dog_rates/status/888078434458587136/photo/1,https://twitter.com/dog_rates/status/888078434458587136/photo/1",12,10,Gerald,,https://pbs.twimg.com/media/DFMWn56WsAAkA7B.jpg,1,french_bulldog,0.9950260000000001,True,pug,0.0009319080000000001,True,bull_mastiff,0.000903211,True
20,27266,False,This is Jeffrey. He has a monopoly on the pool noodles. Currently running a 'boop for two' midweek sale. 13/10 h*ckin strategic https://t.co/PhrUk20Q64,887705289381826560,4654,False,21,,,,https://twitter.com/dog_rates/status/887705289381826560/photo/1,13,10,Jeffrey,,https://pbs.twimg.com/media/DFHDQBbXgAEqY7t.jpg,1,basset,0.821664,True,redbone,0.0875815,True,weimaraner,0.026236400000000003,True
21,61723,False,This is Canela. She attempted some fancy porch pics. They were unsuccessful. 13/10 someone help her https://t.co/cLyzpcUcMX,887473957103951883,15459,False,23,,,,"https://twitter.com/dog_rates/status/887473957103951883/photo/1,https://twitter.com/dog_rates/status/887473957103951883/photo/1",13,10,Canela,,https://pbs.twimg.com/media/DFDw2tyUQAAAFke.jpg,2,pembroke,0.809197,True,rhodesian_ridgeback,0.05495,True,beagle,0.0389148,True
22,30286,False,You may not have known you needed to see this today. 13/10 please enjoy (IG: emmylouroo) https://t.co/WZqNqygEyV,887343217045368832,9062,False,24,,,,https://twitter.com/dog_rates/status/887343217045368832/video/1,13,10,None,,https://pbs.twimg.com/ext_tw_video_thumb/887343120832229379/pu/img/6HSuFrW1lzI_9Mht.jpg,1,mexican_hairless,0.330741,True,sea_lion,0.275645,False,weimaraner,0.134203,True
23,27623,False,This... is a Jubilant Antarctic House Bear. We only rate dogs. Please only send dogs. Thank you... 12/10 would suffocate in floof https://t.co/4Ad1jzJSdp,887101392804085760,5129,False,25,,,,https://twitter.com/dog_rates/status/887101392804085760/photo/1,12,10,None,,https://pbs.twimg.com/media/DE-eAq6UwAA-jaE.jpg,1,samoyed,0.733942,True,eskimo_dog,0.0350295,True,staffordshire_bullterrier,0.029704700000000007,True
24,31163,False,This is Maya. She's very shy. Rarely leaves her cup. 13/10 would find her an environment to thrive in https://t.co/I6oNy0CgiT,886983233522544640,6542,False,26,,,,"https://twitter.com/dog_rates/status/886983233522544640/photo/1,https://twitter.com/dog_rates/status/886983233522544640/photo/1",13,10,Maya,,https://pbs.twimg.com/media/DE8yicJW0AAAvBJ.jpg,2,chihuahua,0.793469,True,toy_terrier,0.143528,True,can_opener,0.0322529,False
25,10743,False,"This is Mingus. He's a wonderful father to his smol pup. Confirmed 13/10, but he needs your help

https://t.co/bVi0Yr4Cff https://t.co/ISvKOSkd5b",886736880519319552,2725,False,27,,,,"https://www.gofundme.com/mingusneedsus,https://twitter.com/dog_rates/status/886736880519319552/photo/1,https://twitter.com/dog_rates/status/886736880519319552/photo/1",13,10,Mingus,,https://pbs.twimg.com/media/DE5Se8FXcAAJFx4.jpg,1,kuvasz,0.309706,True,great_pyrenees,0.186136,True,dandie_dinmont,0.08634630000000001,True
26,20223,False,This is Derek. He's late for a dog meeting. 13/10 pet...al to the metal https://t.co/BCoWue0abA,886680336477933568,3846,False,28,,,,https://twitter.com/dog_rates/status/886680336477933568/photo/1,13,10,Derek,,https://pbs.twimg.com/media/DE4fEDzWAAAyHMM.jpg,1,convertible,0.738995,False,sports_car,0.139952,False,car_wheel,0.044172699999999995,False
27,18994,False,This is Roscoe. Another pupper fallen victim to spontaneous tongue ejections. Get the BlepiPen immediate. 12/10 deep breaths Roscoe https://t.co/RGE08MIJox,886366144734445568,2714,False,29,,,,"https://twitter.com/dog_rates/status/886366144734445568/photo/1,https://twitter.com/dog_rates/status/886366144734445568/photo/1",12,10,Roscoe,pupper,https://pbs.twimg.com/media/DE0BTnQUwAApKEH.jpg,1,french_bulldog,0.999201,True,chihuahua,0.00036117800000000003,True,boston_bull,7.55616e-05,True
28,25159,False,This is Waffles. His doggles are pupside down. Unsure how to fix. 13/10 someone assist Waffles https://t.co/xZDA9Qsq1O,886258384151887873,5430,False,30,,,,https://twitter.com/dog_rates/status/886258384151887873/photo/1,13,10,Waffles,,https://pbs.twimg.com/media/DEyfTG4UMAE4aE9.jpg,1,pug,0.943575,True,shower_cap,0.0252856,False,siamese_cat,0.00284892,False
29,29307,False,Viewer discretion advised. This is Jimbo. He will rip ur finger right h*ckin off. Other dog clearly an accessory. 12/10 pls pet with caution https://t.co/BuveP0uMF1,885984800019947520,5773,False,31,,,,https://twitter.com/dog_rates/status/885984800019947520/photo/1,12,10,Jimbo,,https://pbs.twimg.com/media/DEumeWWV0AA-Z61.jpg,1,blenheim_spaniel,0.9724940000000001,True,shih-tzu,0.00663012,True,bernese_mountain_dog,0.00623915,True
30,32351,False,This is Maisey. She fell asleep mid-excavation. Happens to the best of us. 13/10 would pat noggin approvingly https://t.co/tp1kQ8i9JF,885528943205470208,5505,False,32,,,,https://twitter.com/dog_rates/status/885528943205470208/photo/1,13,10,Maisey,,https://pbs.twimg.com/media/DEoH3yvXgAAzQtS.jpg,1,pug,0.369275,True,labrador_retriever,0.265835,True,kuvasz,0.134697,True
31,0,False,RT @dog_rates: This is Lilly. She just parallel barked. Kindly requests a reward now. 13/10 would pet so well https://t.co/SATN4If5H5,885311592912609280,15880,False,33,8.30583320585e+17,4196983835.0,2017-02-12 01:04:29,"https://twitter.com/dog_rates/status/830583320585068544/photo/1,https://twitter.com/dog_rates/status/830583320585068544/photo/1,https://twitter.com/dog_rates/status/830583320585068544/photo/1,https://twitter.com/dog_rates/status/830583320585068544/photo/1",13,10,Lilly,,https://pbs.twimg.com/media/C4bTH6nWMAAX_bJ.jpg,1,labrador_retriever,0.908703,True,seat_belt,0.0570909,False,pug,0.0119335,True
32,19689,False,Here we have a corgi undercover as a malamute. Pawbably doing important investigative work. Zero control over tongue happenings. 13/10 https://t.co/44ItaMubBf,885167619883638784,3763,False,34,,,,"https://twitter.com/dog_rates/status/885167619883638784/photo/1,https://twitter.com/dog_rates/status/885167619883638784/photo/1,https://twitter.com/dog_rates/status/885167619883638784/photo/1,https://twitter.com/dog_rates/status/885167619883638784/photo/1",13,10,None,,https://pbs.twimg.com/media/DEi_N9qXYAAgEEw.jpg,4,malamute,0.8124819999999999,True,siberian_husky,0.0717125,True,eskimo_dog,0.0557697,True
33,69059,False,"This is Earl. He found a hat. Nervous about what you think of it. 12/10 it's delightful, Earl https://t.co/MYJvdlNRVa",884925521741709313,15485,False,35,,,,https://twitter.com/dog_rates/status/884925521741709313/photo/1,12,10,Earl,,https://pbs.twimg.com/media/DEfjEaNXkAAtPlj.jpg,1,italian_greyhound,0.259916,True,american_staffordshire_terrier,0.198451,True,staffordshire_bullterrier,0.127725,True
34,24997,False,This is Lola. It's her first time outside. Must test the earth and taste the atmosphere. 13/10 you're doing great Lola https://t.co/74TKAUsLkO,884876753390489601,4797,False,36,,,,"https://twitter.com/dog_rates/status/884876753390489601/photo/1,https://twitter.com/dog_rates/status/884876753390489601/photo/1,https://twitter.com/dog_rates/status/884876753390489601/photo/1,https://twitter.com/dog_rates/status/884876753390489601/photo/1",13,10,Lola,,https://pbs.twimg.com/media/DEe2tZXXkAAwyX3.jpg,1,chow,0.822103,True,norwich_terrier,0.106075,True,norfolk_terrier,0.0373485,True
35,21846,False,This is Kevin. He's just so happy. 13/10 what is your secret Kevin https://t.co/1r4MFCbCX5,884562892145688576,4028,False,37,,,,https://twitter.com/dog_rates/status/884562892145688576/photo/1,13,10,Kevin,,https://pbs.twimg.com/media/DEaZQkfXUAEC7qB.jpg,1,pug,0.5464060000000001,True,french_bulldog,0.404291,True,brabancon_griffon,0.044001900000000004,True
36,24431,False,"I present to you, Pup in Hat. Pup in Hat is great for all occasions. Extremely versatile. Compact as h*ck. 14/10 (IG: itselizabethgales) https://t.co/vvBOcC2VdC",884441805382717440,4915,False,38,,,,https://twitter.com/dog_rates/status/884441805382717440/photo/1,14,10,None,,https://pbs.twimg.com/media/DEYrIZwWsAA2Wo5.jpg,1,pembroke,0.993225,True,cardigan,0.00321648,True,chihuahua,0.00208089,True
37,18374,False,Meet Yogi. He doesn't have any important dog meetings today he just enjoys looking his best at all times. 12/10 for dangerously dapper doggo https://t.co/YSI00BzTBZ,884162670584377345,2567,False,39,,,,https://twitter.com/dog_rates/status/884162670584377345/photo/1,12,10,Yogi,doggo,https://pbs.twimg.com/media/DEUtQbzW0AUTv_o.jpg,1,german_shepherd,0.707046,True,malinois,0.199396,True,norwegian_elkhound,0.0491476,True
38,19657,False,This is Noah. He can't believe someone made this mess. Got the vacuum out for you though. Offered to help clean pup. 12/10 super good boy https://t.co/V85xujjDDY,883838122936631299,2949,False,40,,,,https://twitter.com/dog_rates/status/883838122936631299/photo/1,12,10,Noah,,https://pbs.twimg.com/media/DEQGFgAXUAAEvfi.jpg,1,doberman,0.610946,True,miniature_pinscher,0.299603,True,kelpie,0.0630203,True
39,41214,False,"This is Bella. She hopes her smile made you smile. If not, she is also offering you her favorite monkey. 13.5/10 https://t.co/qjrljjt948",883482846933004288,8510,False,41,,,,"https://twitter.com/dog_rates/status/883482846933004288/photo/1,https://twitter.com/dog_rates/status/883482846933004288/photo/1",5,10,Bella,,https://pbs.twimg.com/media/DELC9dZXUAADqUk.jpg,1,golden_retriever,0.943082,True,labrador_retriever,0.032409,True,kuvasz,0.00550072,True
40,20411,False,Meet Grizzwald. He may be the floofiest floofer I ever did see. Lost eyes saving a schoolbus from a volcano erpuption. 13/10 heroic as h*ck https://t.co/rf661IFEYP,883360690899218434,3169,False,42,,,,https://twitter.com/dog_rates/status/883360690899218434/photo/1,13,10,Grizzwald,floofer,https://pbs.twimg.com/media/DEJT3FeXoAAtwUy.jpg,1,chow,0.9879969999999999,True,tibetan_mastiff,0.00709872,True,newfoundland,0.00214033,True
41,33353,False,"Please only send dogs. We don't rate mechanics, no matter how h*ckin good. Thank you... 13/10 would sneak a pat https://t.co/Se5fZ9wp5E",883117836046086144,5694,False,43,,,,"https://twitter.com/dog_rates/status/883117836046086144/photo/1,https://twitter.com/dog_rates/status/883117836046086144/photo/1",13,10,None,,https://pbs.twimg.com/media/DEF2-_hXoAAs62q.jpg,2,golden_retriever,0.9495620000000001,True,labrador_retriever,0.04594790000000002,True,kuvasz,0.00247094,True
42,21491,False,This is Rusty. He wasn't ready for the first pic. Clearly puppared for the second. 13/10 confirmed great boy https://t.co/tyER0KpdXj,882992080364220416,3325,False,44,,,,"https://twitter.com/dog_rates/status/882992080364220416/photo/1,https://twitter.com/dog_rates/status/882992080364220416/photo/1",13,10,Rusty,,https://pbs.twimg.com/media/DEEEnIqXYAAiJh_.jpg,1,eskimo_dog,0.46677799999999997,True,siberian_husky,0.406044,True,dingo,0.07341439999999999,False
43,25397,False,This is Gus. He's quite the cheeky pupper. Already perfected the disinterested wink. 12/10 would let steal my girl https://t.co/D43I96SlVu,882762694511734784,4213,False,45,,,,https://twitter.com/dog_rates/status/882762694511734784/photo/1,12,10,Gus,pupper,https://pbs.twimg.com/media/DEAz_HHXsAA-p_z.jpg,1,labrador_retriever,0.85005,True,chesapeake_bay_retriever,0.074257,True,flat-coated_retriever,0.015579399999999997,True
44,25210,False,This is Stanley. He has his first swim lesson today. Doggle straps adjusted. Ready to go. 13/10 Phelps is nervous (IG: stanleythe_corgi) https://t.co/Nx52PGwH94,882627270321602560,5217,False,46,,,,https://twitter.com/dog_rates/status/882627270321602560/photo/1,13,10,Stanley,,https://pbs.twimg.com/media/DD-40X3WAAAJPU5.jpg,1,pembroke,0.542982,True,chihuahua,0.251988,True,cardigan,0.107699,True
45,40215,False,This is Alfy. You're witnessing his first watermelon experience. I think it was a success. 13/10 happy 4th Alfy ðŸ‡ºðŸ‡¸ https://t.co/fYP5RlutfA,882268110199369728,9962,False,47,,,,"https://twitter.com/dog_rates/status/882268110199369728/photo/1,https://twitter.com/dog_rates/status/882268110199369728/photo/1,https://twitter.com/dog_rates/status/882268110199369728/photo/1",13,10,Alfy,,https://pbs.twimg.com/media/DD5yKdPW0AArzX8.jpg,1,golden_retriever,0.762211,True,labrador_retriever,0.09898489999999999,True,cocker_spaniel,0.0171995,True
46,26385,False,"This is Koko. Her owner, inspired by Barney, recently built a cart for her to use during walks if she got tired. 13/10 rest easy Koko https://t.co/zeDpnsKX7w",882045870035918850,4192,False,48,,,,"https://twitter.com/dog_rates/status/882045870035918850/photo/1,https://twitter.com/dog_rates/status/882045870035918850/photo/1,https://twitter.com/dog_rates/status/882045870035918850/photo/1,https://twitter.com/dog_rates/status/882045870035918850/photo/1",13,10,Koko,,https://pbs.twimg.com/media/DD2oCl2WAAEI_4a.jpg,1,web_site,0.949591,False,dhole,0.0173258,False,golden_retriever,0.00694063,True
47,21956,False,This is Rey. He's a Benebop Cumberfloof. 12/10 dangerously pettable https://t.co/503CgWbhxQ,881906580714921986,2931,False,49,,,,https://twitter.com/dog_rates/status/881906580714921986/photo/1,12,10,Rey,,https://pbs.twimg.com/media/DD0pWm9XcAAeSBL.jpg,1,weimaraner,0.291539,True,chesapeake_bay_retriever,0.278966,True,koala,0.12701700000000002,False
48,45641,False,This is Gary. He couldn't miss this puppertunity for a selfie. Flawless focusing skills. 13/10 would boop intensely https://t.co/7CSWCl8I6s,881666595344535552,9213,False,50,,,,https://twitter.com/dog_rates/status/881666595344535552/photo/1,13,10,Gary,,https://pbs.twimg.com/media/DDxPFwbWAAEbVVR.jpg,1,saluki,0.529012,True,afghan_hound,0.25000300000000003,True,golden_retriever,0.16073900000000002,True
49,20989,False,Meet Elliot. He's a Canadian Forrest Pup. Unusual number of antlers for a dog. Sneaky tongue slip to celebrate #Canada150. 12/10 would pet https://t.co/cgwJwowTMC,881268444196462592,4601,False,52,,,,https://twitter.com/dog_rates/status/881268444196462592/photo/1,12,10,Elliot,,https://pbs.twimg.com/media/DDrk-f9WAAI-WQv.jpg,1,tusker,0.473303,False,indian_elephant,0.245646,False,ibex,0.0556607,False
50,15411,False,This is Louis. He's crossing. It's a big deal. 13/10 h*ckin breathtaking https://t.co/D0wb1GlKAt,880935762899988482,2408,False,53,,,,https://twitter.com/dog_rates/status/880935762899988482/photo/1,13,10,Louis,,https://pbs.twimg.com/media/DDm2Z5aXUAEDS2u.jpg,1,street_sign,0.251801,False,umbrella,0.115123,False,traffic_light,0.0695338,False
51,19182,False,Ugh not again. We only rate dogs. Please don't send in well-dressed  floppy-tongued street penguins. Dogs only please. Thank you... 12/10 https://t.co/WiAMbTkDPf,880872448815771648,3293,False,54,,,,https://twitter.com/dog_rates/status/880872448815771648/photo/1,12,10,None,,https://pbs.twimg.com/media/DDl8zzJW0AAisCJ.jpg,1,pembroke,0.791416,True,norwich_terrier,0.0613929,True,chihuahua,0.0337257,True
52,25605,False,This is Bella. She had her first beach experience this morning. Complete success. 12/10 would perform a sandy boop https://t.co/4VsFysDmiw,880465832366813184,5358,False,55,,,,"https://twitter.com/dog_rates/status/880465832366813184/photo/1,https://twitter.com/dog_rates/status/880465832366813184/photo/1,https://twitter.com/dog_rates/status/880465832366813184/photo/1,https://twitter.com/dog_rates/status/880465832366813184/photo/1",12,10,Bella,,https://pbs.twimg.com/media/DDgK-J4XUAIEV9W.jpg,1,golden_retriever,0.9132549999999999,True,labrador_retriever,0.0263286,True,cocker_spaniel,0.00937082,True
53,24282,False,Meet Jesse. He's a Fetty Woof. His tongue ejects without warning. A true bleptomaniac. 12/10 would snug well https://t.co/fUod0tVmvK,880221127280381952,3581,False,56,,,,"https://twitter.com/dog_rates/status/880221127280381952/photo/1,https://twitter.com/dog_rates/status/880221127280381952/photo/1",12,10,Jesse,,https://pbs.twimg.com/media/DDcscbXU0AIfDzs.jpg,1,chihuahua,0.238525,True,meerkat,0.104256,False,clumber,0.052580299999999996,True
54,24892,False,Please don't send in photos without dogs in them. We're not @porch_rates. Insubordinate and churlish. Pretty good porch tho 11/10 https://t.co/HauE8M3Bu4,880095782870896641,3748,False,57,,,,https://twitter.com/dog_rates/status/880095782870896641/photo/1,11,10,None,,https://pbs.twimg.com/media/DDa6ckbXgAAM1vV.jpg,1,miniature_pinscher,0.120298,True,rhodesian_ridgeback,0.106395,True,beagle,0.106073,True
55,20202,False,This is Romeo. He would like to do an entrance. Requesting your immediate assistance. 13/10 https://t.co/Qh5aEkRQm9,879862464715927552,3005,False,58,,,,"https://twitter.com/dog_rates/status/879862464715927552/photo/1,https://twitter.com/dog_rates/status/879862464715927552/photo/1,https://twitter.com/dog_rates/status/879862464715927552/photo/1",13,10,Romeo,,https://pbs.twimg.com/media/DDXmPrbWAAEKMvy.jpg,3,basset,0.813507,True,beagle,0.146654,True,cocker_spaniel,0.00948502,True
