,favorite_count,favorited,full_text,tweet_id,retweet_count,retweeted,Unnamed: 0,retweeted_status_id,retweeted_status_user_id,retweeted_status_timestamp,expanded_urls,rating_numerator,rating_denominator,name,dog_stage,jpg_url,img_num,p1,p1_conf,p1_dog,p2,p2_conf,p2_dog,p3,p3_conf,p3_dog
1378,3019,False,This is Alice. She's an idiot. 4/10 https://t.co/VQXdwJfkyS,680940246314430465,974,False,1443,,,,https://twitter.com/dog_rates/status/680940246314430465/photo/1,4,10,Alice,,https://pbs.twimg.com/media/CXMvio7WQAAPZJj.jpg,1,soft-coated_wheaten_terrier,0.289598,True,west_highland_white_terrier,0.157195,True,toy_poodle,0.07443469999999999,True
1379,1980,False,Say hello to Sadie. She's a Tortellini Sidewinder. Very jubilant pup. Seems loyal. Leaves on point. 10/10 petable af https://t.co/g2bTu4ayPl,680934982542561280,408,False,1444,,,,https://twitter.com/dog_rates/status/680934982542561280/photo/1,10,10,Sadie,,https://pbs.twimg.com/media/CXMqwIQWcAA2iE0.jpg,1,labrador_retriever,0.7843979999999999,True,siberian_husky,0.0559251,True,beagle,0.0227501,True
1380,2284,False,Meet Griswold. He's dapper as hell. Already pumped for next Christmas. 11/10 https://t.co/5NrpNDyFzN,680913438424612864,580,False,1445,,,,https://twitter.com/dog_rates/status/680913438424612864/photo/1,11,10,Griswold,,https://pbs.twimg.com/media/CXMXKKHUMAA1QN3.jpg,1,pomeranian,0.615678,True,golden_retriever,0.12645499999999998,True,chihuahua,0.0871836,True
1381,1670,False,This is Cheesy. It's her birthday. She's patiently waiting to eat her party muffin. 9/10 happy birthday pup https://t.co/cH2H7mch2H,680889648562991104,346,False,1446,,,,https://twitter.com/dog_rates/status/680889648562991104/photo/1,9,10,Cheesy,,https://pbs.twimg.com/media/CXMBhXfWEAA4mMI.jpg,1,shetland_sheepdog,0.876337,True,collie,0.078331,True,pomeranian,0.0204075,True
1382,3277,False,This is Ellie. She's secretly ferocious. 12/10 very deadly pupper https://t.co/BF4BW8LUgb,680836378243002368,1243,False,1447,,,,"https://twitter.com/dog_rates/status/680836378243002368/photo/1,https://twitter.com/dog_rates/status/680836378243002368/photo/1,https://twitter.com/dog_rates/status/680836378243002368/photo/1",12,10,Ellie,pupper,https://pbs.twimg.com/media/CXLREjOW8AElfk6.jpg,3,pembroke,0.427781,True,shetland_sheepdog,0.160669,True,pomeranian,0.11125,True
1383,2250,False,Great picture here. Dog on the right panicked &amp; forgot about his tongue. Middle green dog must've fainted. All 10/10 https://t.co/31npKUAox0,680801747103793152,764,False,1448,,,,https://twitter.com/dog_rates/status/680801747103793152/photo/1,10,10,None,,https://pbs.twimg.com/media/CXKxkseW8AAjAMY.jpg,1,pug,0.99672,True,labrador_retriever,0.00143879,True,staffordshire_bullterrier,0.000517603,True
1384,2685,False,Say hello to Moofasa. He must be a powerful dog. Fenced in for your protection. Just got his ear pierced. 6/10 https://t.co/w6fRfQ3RXD,680798457301471234,966,False,1449,,,,https://twitter.com/dog_rates/status/680798457301471234/photo/1,6,10,Moofasa,,https://pbs.twimg.com/media/CXKuiyHUEAAMAGa.jpg,1,ram,0.49976099999999996,False,hog,0.28379499999999996,False,ox,0.0674551,False
1385,2491,False,This is Brody. That is his chair. He loves his chair. Never leaves it. 9/10 might be stuck actually https://t.co/WvJRg0XJit,680609293079592961,651,False,1450,,,,https://twitter.com/dog_rates/status/680609293079592961/photo/1,9,10,Brody,,https://pbs.twimg.com/media/CXICiB9UwAE1sKY.jpg,1,french_bulldog,0.700764,True,chihuahua,0.07238960000000001,True,american_staffordshire_terrier,0.03961869999999999,True
1386,3424,False,This is Penny. Her tennis ball slowly rolled down her cone and into the pool. 8/10 bad things happen to good puppers https://t.co/YNWU7LeFgg,680583894916304897,1238,False,1451,,,,"https://twitter.com/dog_rates/status/680583894916304897/photo/1,https://twitter.com/dog_rates/status/680583894916304897/photo/1,https://twitter.com/dog_rates/status/680583894916304897/photo/1,https://twitter.com/dog_rates/status/680583894916304897/photo/1",8,10,Penny,,https://pbs.twimg.com/media/CXHrcFYWcAEE5_L.jpg,1,tub,0.8898010000000001,False,bathtub,0.032351099999999994,False,hippopotamus,0.0141773,False
1387,3995,False,Meet Percy. He's a Latvian Yuletide Heineken. Refuses to take off sweater. Kinda feisty. 12/10 would keep in pocket https://t.co/QGM5Fcuv7s,680497766108381184,1798,False,1452,,,,https://twitter.com/dog_rates/status/680497766108381184/photo/1,12,10,Percy,,https://pbs.twimg.com/media/CXGdG0aWcAEbOO1.jpg,1,chihuahua,0.538354,True,muzzle,0.0842887,False,ski_mask,0.07669010000000001,False
1388,1626,False,Here we have uncovered an entire battalion of holiday puppers. Average of 11.26/10 https://t.co/eNm2S6p9BD,680494726643068929,454,False,1453,,,,https://twitter.com/dog_rates/status/680494726643068929/photo/1,26,10,None,,https://pbs.twimg.com/media/CXGaVxOWAAADjhF.jpg,1,kuvasz,0.43862700000000004,True,samoyed,0.111622,True,great_pyrenees,0.0640608,True
1389,2409,False,"This is Hector. He thinks he's a hammer. Silly Hector. You're a pupper, not a hammer. 10/10 https://t.co/OdUFuZIXiI",680473011644985345,707,False,1454,,,,https://twitter.com/dog_rates/status/680473011644985345/photo/1,10,10,Hector,pupper,https://pbs.twimg.com/media/CXGGlzvWYAArPfk.jpg,1,lakeland_terrier,0.796694,True,west_highland_white_terrier,0.138709,True,norwich_terrier,0.016253399999999998,True
1390,1371,False,Merry Christmas. My gift to you is this tiny unicorn running into a wall in slow motion. 11/10 https://t.co/UKqIAnR3He,680440374763077632,467,False,1455,,,,https://twitter.com/dog_rates/status/680440374763077632/video/1,11,10,None,,https://pbs.twimg.com/ext_tw_video_thumb/680440290977693696/pu/img/B900g7b-n-zhnwi5.jpg,1,space_heater,0.920367,False,radiator,0.0499332,False,electric_fan,0.00671903,False
1391,2688,False,I hope everyone enjoys this picture as much as I do. This is Toby. 12/10 https://t.co/vHnu1g9EJm,680206703334408192,1094,False,1457,,,,https://twitter.com/dog_rates/status/680206703334408192/photo/1,12,10,Toby,,https://pbs.twimg.com/media/CXCUYcRW8AAObYM.jpg,1,christmas_stocking,0.149758,False,cloak,0.12883,False,teddy,0.10912899999999999,False
1392,2039,False,Here's a sleepy Christmas pupper 11/10 https://t.co/KXg0f8GNQ9,680191257256136705,469,False,1458,,,,https://twitter.com/dog_rates/status/680191257256136705/photo/1,11,10,None,pupper,https://pbs.twimg.com/media/CXCGVXyWsAAAVHE.jpg,1,brittany_spaniel,0.7332529999999999,True,welsh_springer_spaniel,0.251634,True,english_springer,0.00924321,True
1393,3676,False,This pupper is patiently waiting to scare the shit out of Santa. 10/10 https://t.co/NhXo67K6yt,680176173301628928,1447,False,1459,,,,https://twitter.com/dog_rates/status/680176173301628928/photo/1,10,10,None,pupper,https://pbs.twimg.com/media/CXB4nWnWEAAhLTX.jpg,1,christmas_stocking,0.20754699999999998,False,mask,0.19388,False,feather_boa,0.152738,False
1394,2209,False,Meet Goliath. He's an example of irony. Head is phenomenally round. Wants to be an ornament. 12/10 would hug gently https://t.co/72Dil0Aktw,680161097740095489,692,False,1460,,,,https://twitter.com/dog_rates/status/680161097740095489/photo/1,12,10,Goliath,,https://pbs.twimg.com/media/CXBq6RPWkAAaNuU.jpg,1,bluetick,0.268681,True,miniature_pinscher,0.12565199999999999,True,english_setter,0.0893727,True
1395,3424,False,Say hello to Kawhi. He was doing fine until his hat fell off. He got it back though. 10/10 deep breaths pupper https://t.co/N5pM6WBx7e,680145970311643136,1630,False,1461,,,,"https://twitter.com/dog_rates/status/680145970311643136/photo/1,https://twitter.com/dog_rates/status/680145970311643136/photo/1,https://twitter.com/dog_rates/status/680145970311643136/photo/1",10,10,Kawhi,pupper,https://pbs.twimg.com/media/CXBdJxLUsAAWql2.jpg,1,miniature_poodle,0.457117,True,toy_poodle,0.226481,True,maltese_dog,0.0676815,True
1396,2174,False,This is Reggie. His Santa hat is a little big. 10/10 he's still having fun https://t.co/w0dcGXq7qK,680130881361686529,883,False,1462,,,,https://twitter.com/dog_rates/status/680130881361686529/photo/1,10,10,Reggie,,https://pbs.twimg.com/media/CXBPbVtWAAA2Vus.jpg,1,maltese_dog,0.199121,True,west_highland_white_terrier,0.197897,True,shih-tzu,0.15713,True
1397,2575,False,This is Ozzy. He woke up 2 minutes before he had to be ready for the Christmas party. 9/10 classic Ozzy https://t.co/Kt9vmw0Fap,680115823365742593,855,False,1463,,,,https://twitter.com/dog_rates/status/680115823365742593/photo/1,9,10,Ozzy,,https://pbs.twimg.com/media/CXBBurSWMAELewi.jpg,1,pug,0.999365,True,french_bulldog,0.000543615,True,boston_bull,2.8152800000000013e-05,True
1398,3410,False,This pupper is not coming inside until she catches a snowflake on her tongue. 11/10 the determination is palpable https://t.co/lvMYbmKq8H,680100725817409536,1297,False,1464,,,,https://twitter.com/dog_rates/status/680100725817409536/photo/1,11,10,None,pupper,https://pbs.twimg.com/media/CW-loUBWYAAn2Cb.jpg,1,golden_retriever,0.6989609999999999,True,chow,0.14597100000000002,True,pomeranian,0.034888,True
1399,2449,False,Say hello to Emmie. She's trapped in an ornament. Tragic af. Looks pretty content tho. Maybe it's meant to be. 9/10 https://t.co/Fh7geodBCU,680070545539371008,807,False,1466,,,,https://twitter.com/dog_rates/status/680070545539371008/photo/1,9,10,Emmie,,https://pbs.twimg.com/media/CW-dU34WQAANBGy.jpg,1,earthstar,0.127701,False,shih-tzu,0.12181099999999999,True,bubble,0.11782000000000001,False
1400,1870,False,Meet Penelope. She's a bacon frise. Total babe (lol get it like the movie). Doesn't bark tho. 5/10 very average dog https://t.co/SDcQYg0HSZ,679877062409191424,606,False,1468,,,,https://twitter.com/dog_rates/status/679877062409191424/photo/1,5,10,Penelope,,https://pbs.twimg.com/media/CW9olDsUsAA0XSf.jpg,1,hog,0.809466,False,hay,0.060177800000000004,False,lumbermill,0.0164834,False
1401,2327,False,"""Dammit hooman I'm jus trynna lik the fler"" 11/10 https://t.co/eRZRI8OTj7",679862121895714818,577,False,1469,,,,https://twitter.com/dog_rates/status/679862121895714818/photo/1,11,10,None,,https://pbs.twimg.com/media/CW9a_h1WwAApmAy.jpg,1,entlebucher,0.5232060000000001,True,greater_swiss_mountain_dog,0.43165699999999996,True,appenzeller,0.0442079,True
1402,2700,False,This is Bruce. He's a rare pup. Covered in Frosted Flakes. Nifty gold teeth. Overall good dog. 7/10 would pet firmly https://t.co/RtxxACzZ8A,679854723806179328,1151,False,1470,,,,https://twitter.com/dog_rates/status/679854723806179328/photo/1,7,10,Bruce,,https://pbs.twimg.com/media/CW9UQ7oWkAAErmU.jpg,1,llama,0.887963,False,ram,0.0950207,False,chow,0.00230739,True
1403,2253,False,This is Willie. He's floating away and needs your assistance. Please someone help Willie. 10/10 https://t.co/MJqygWqt8X,679844490799091713,709,False,1471,,,,https://twitter.com/dog_rates/status/679844490799091713/photo/1,10,10,Willie,,https://pbs.twimg.com/media/CW9K9VeVAAE0j-x.jpg,1,airedale,0.903832,True,border_terrier,0.034712599999999996,True,toy_poodle,0.021378,True
1404,34185,False,Everybody look at this beautiful pupper 13/10 https://t.co/hyAC5Hq9GC,679828447187857408,13068,False,1472,,,,"https://twitter.com/dog_rates/status/679828447187857408/photo/1,https://twitter.com/dog_rates/status/679828447187857408/photo/1,https://twitter.com/dog_rates/status/679828447187857408/photo/1",13,10,None,pupper,https://pbs.twimg.com/media/CW88XN4WsAAlo8r.jpg,3,chihuahua,0.346545,True,dalmatian,0.166246,True,toy_terrier,0.117502,True
1405,2942,False,This is Rinna. She's melting. 10/10 get inside pupper https://t.co/PA0czwucsb,679777920601223168,1027,False,1473,,,,https://twitter.com/dog_rates/status/679777920601223168/photo/1,10,10,Rinna,pupper,https://pbs.twimg.com/media/CW8OYajUMAAPRoF.jpg,1,bloodhound,0.5288189999999999,True,bull_mastiff,0.42011899999999996,True,french_bulldog,0.00948059,True
1406,1979,False,This pup's name is Sabertooth (parents must be cool). Ears for days. Jumps unannounced. 9/10 would pet diligently https://t.co/iazoiNUviP,679736210798047232,742,False,1474,,,,https://twitter.com/dog_rates/status/679736210798047232/photo/1,9,10,None,,https://pbs.twimg.com/media/CW7oelWWcAAhyzz.jpg,1,french_bulldog,0.319139,True,chihuahua,0.154088,True,cardigan,0.11768800000000001,True
1407,2051,False,This is Hunter. He was playing with his ball minding his own business. Has no idea what happened to the carpet. 8/10 https://t.co/DbUTDI3u1R,679729593985699840,780,False,1475,,,,https://twitter.com/dog_rates/status/679729593985699840/photo/1,8,10,Hunter,,https://pbs.twimg.com/media/CW7iddWUsAElUC0.jpg,1,wallaby,0.164215,False,west_highland_white_terrier,0.09351480000000001,True,ashcan,0.0672783,False
1408,1580,False,This is Mike. He is a Jordanian Frito Pilates. Frowning because he can't see directly in front of him. 8/10 https://t.co/NL5QJwdEpF,679722016581222400,441,False,1476,,,,https://twitter.com/dog_rates/status/679722016581222400/photo/1,8,10,Mike,,https://pbs.twimg.com/media/CW7bkW6WQAAksgB.jpg,1,boxer,0.459604,True,boston_bull,0.197913,True,french_bulldog,0.0870225,True
1409,2493,False,This little pupper just arrived. 11/10 would snug https://t.co/DA5aqnSGfB,679527802031484928,680,False,1478,,,,https://twitter.com/dog_rates/status/679527802031484928/photo/1,11,10,None,pupper,https://pbs.twimg.com/media/CW4q7jDWkAA2y8g.jpg,1,mailbox,0.336393,False,cannon,0.158936,False,cuirass,0.0526471,False
1410,3166,False,Say hello to William. He makes fun of others because he's terrified of his own deep-seated insecurities. 7/10 https://t.co/bwuV6FlRxr,679511351870550016,1179,False,1479,,,,https://twitter.com/dog_rates/status/679511351870550016/photo/1,7,10,William,,https://pbs.twimg.com/media/CW4b-GUWYAAa8QO.jpg,1,chihuahua,0.761972,True,black-footed_ferret,0.150605,False,squirrel_monkey,0.028147900000000007,False
1411,2994,False,This is Dwight. He's a pointy pupper. Very docile. Attracts marshmallows. Hurts to pet but definitely worth it 8/10 https://t.co/jjW7zTxY9Z,679503373272485890,1370,False,1480,,,,https://twitter.com/dog_rates/status/679503373272485890/photo/1,8,10,Dwight,pupper,https://pbs.twimg.com/media/CW4UtmYWsAAEjqA.jpg,1,porcupine,0.9998459999999999,False,meerkat,7.191479999999999e-05,False,echidna,4.44729e-05,False
1412,1978,False,This is Evy. She doesn't want to be a Koala. 9/10 https://t.co/VITeF0Kl9L,679475951516934144,602,False,1481,,,,https://twitter.com/dog_rates/status/679475951516934144/photo/1,9,10,Evy,,https://pbs.twimg.com/media/CW37xZbUoAAUXe5.jpg,1,maltese_dog,0.145742,True,toy_poodle,0.139407,True,west_highland_white_terrier,0.108821,True
1413,29696,False,Meet Hurley. He's the curly one. He hugs every other dog he sees during his walk. 11/10 for spreading the love https://t.co/M6vqkt2GKV,679462823135686656,17510,False,1482,,,,https://twitter.com/dog_rates/status/679462823135686656/photo/1,11,10,Hurley,,https://pbs.twimg.com/media/CW3v1KxW8AAIOuy.jpg,1,toy_poodle,0.62178,True,miniature_poodle,0.197819,True,soft-coated_wheaten_terrier,0.046745,True
1414,20008,False,This is Rubio. He has too much skin. 11/10 https://t.co/NLOHmlENag,679158373988876288,7495,False,1483,,,,https://twitter.com/dog_rates/status/679158373988876288/photo/1,11,10,Rubio,,https://pbs.twimg.com/media/CWza7kpWcAAdYLc.jpg,1,pug,0.27220500000000003,True,bull_mastiff,0.25153000000000003,True,bath_towel,0.116806,False
1415,2635,False,I know everyone's excited for Christmas but that doesn't mean you can send in reindeer. We only rate dogs... 8/10 https://t.co/eWjWgbOCYL,679148763231985668,964,False,1484,,,,https://twitter.com/dog_rates/status/679148763231985668/photo/1,8,10,None,,https://pbs.twimg.com/media/CWzSMmAWsAAyB1u.jpg,1,italian_greyhound,0.302685,True,hair_slide,0.12428099999999999,False,afghan_hound,0.059846,True
1416,2803,False,This is Louis. He's a river dancer. His friends think it's badass. All are very supportive. 10/10 for Louis https://t.co/qoIvjKMY58,679132435750195208,1078,False,1485,,,,https://twitter.com/dog_rates/status/679132435750195208/photo/1,10,10,Louis,,https://pbs.twimg.com/media/CWzDWOkXAAAP0k7.jpg,1,scottish_deerhound,0.19460999999999998,True,irish_wolfhound,0.162855,True,giant_schnauzer,0.15983699999999998,True
1417,15952,False,This is Chompsky. He lives up to his name. 11/10 https://t.co/Xl37lQEWd0,679062614270468097,7478,False,1487,,,,"https://twitter.com/dog_rates/status/679062614270468097/photo/1,https://twitter.com/dog_rates/status/679062614270468097/photo/1",11,10,Chompsky,,https://pbs.twimg.com/media/CWyD2HGUYAQ1Xa7.jpg,2,cash_machine,0.802333,False,schipperke,0.0455186,True,german_shepherd,0.0233535,True
1418,2119,False,This dog doesn't know how to stairs. Quite tragic really. 9/10 get it together pup https://t.co/kTpr9PTMg1,679047485189439488,610,False,1488,,,,https://twitter.com/dog_rates/status/679047485189439488/photo/1,9,10,None,,https://pbs.twimg.com/media/CWx2FaLWcAEQ3vh.jpg,1,panpipe,0.962572,False,bannister,0.0252482,False,golden_retriever,0.00293035,True
1419,2142,False,If your Monday isn't going so well just take a look at this. Both 12/10 https://t.co/GJT6SILPGU,678991772295516161,1070,False,1489,,,,https://twitter.com/dog_rates/status/678991772295516161/photo/1,12,10,None,,https://pbs.twimg.com/media/CWxDaXHWsAAWV8W.jpg,1,eskimo_dog,0.330216,True,siberian_husky,0.187003,True,chihuahua,0.10142000000000001,True
1420,1545,False,Meet Lola. She's a Metamorphic Chartreuse. Plays with her food. Insubordinate and churlish. Exquisite hardwood 11/10 https://t.co/etpBNXwN7f,678969228704284672,423,False,1490,,,,https://twitter.com/dog_rates/status/678969228704284672/photo/1,11,10,Lola,,https://pbs.twimg.com/media/CWwu6OLUkAEo3gq.jpg,1,labrador_retriever,0.680251,True,chesapeake_bay_retriever,0.20169700000000002,True,golden_retriever,0.019675900000000003,True
1421,2424,False,Here's a pupper with some mean tan lines. Snazzy sweater though 12/10 https://t.co/DpCSVsl6vu,678800283649069056,844,False,1491,,,,https://twitter.com/dog_rates/status/678800283649069056/photo/1,12,10,None,pupper,https://pbs.twimg.com/media/CWuVQSLW4AAI3w9.jpg,1,labrador_retriever,0.213673,True,beagle,0.146235,True,airedale,0.122701,True
1422,3245,False,This is Linda. She fucking hates trees. 7/10 https://t.co/blaY85FIxR,678798276842360832,1074,False,1492,,,,https://twitter.com/dog_rates/status/678798276842360832/photo/1,7,10,Linda,,https://pbs.twimg.com/media/CWuTbAKUsAAvZHh.jpg,1,airedale,0.583122,True,silky_terrier,0.12956700000000002,True,lakeland_terrier,0.09472660000000001,True
1423,2647,False,This is Tug. He's not required to wear the cone he just wants his voice to project more clearly. 11/10 https://t.co/Sp739Ou2qx,678774928607469569,844,False,1493,,,,https://twitter.com/dog_rates/status/678774928607469569/photo/1,11,10,Tug,,https://pbs.twimg.com/media/CWt-MNIWEAAUC9S.jpg,1,pembroke,0.194681,True,toy_poodle,0.121821,True,pomeranian,0.096843,True
1424,3314,False,This is Mia. She makes awful decisions. 8/10 https://t.co/G6TQVgTcZz,678767140346941444,1267,False,1494,,,,https://twitter.com/dog_rates/status/678767140346941444/photo/1,8,10,Mia,,https://pbs.twimg.com/media/CWt3G6EVEAIGEPr.jpg,1,harp,0.8211200000000001,False,window_screen,0.0251208,False,mosquito_net,0.016715599999999997,False
1425,1532,False,"Meet Wilson. He got caught humping the futon. He's like ""dude, help me out here"" 10/10 I'd help Wilson out https://t.co/m6XoclB0qv",678764513869611008,434,False,1495,,,,https://twitter.com/dog_rates/status/678764513869611008/photo/1,10,10,Wilson,,https://pbs.twimg.com/media/CWt0ubZWcAAkFER.jpg,1,irish_terrier,0.696646,True,australian_terrier,0.0749616,True,irish_setter,0.06390119999999999,True
1426,6677,False,This is Dash. He didn't think the water would be that cold. Damn it Dash it's December. Think a little. 10/10 https://t.co/NqcOwG8pxW,678755239630127104,3040,False,1496,,,,https://twitter.com/dog_rates/status/678755239630127104/photo/1,10,10,Dash,,https://pbs.twimg.com/media/CWtsSQAUkAAnWws.jpg,1,malamute,0.606654,True,border_collie,0.193831,True,collie,0.0483781,True
1427,3514,False,Meet Tango. He's a large dog. Doesn't care much for personal space. Owner isn't very accepting. Tongue slip. 6/10 https://t.co/p2T5kGebxe,678740035362037760,1545,False,1497,,,,https://twitter.com/dog_rates/status/678740035362037760/photo/1,6,10,Tango,,https://pbs.twimg.com/media/CWtede2WIAAF_AJ.jpg,1,seat_belt,0.7871640000000001,False,sunglasses,0.04573869999999999,False,beagle,0.0225251,True
1428,2683,False,Exotic pup here. Tail long af. Throat looks swollen. Might breathe fire. Exceptionally unfluffy 2/10 would still pet https://t.co/a8SqCaSo2r,678675843183484930,1361,False,1498,,,,https://twitter.com/dog_rates/status/678675843183484930/photo/1,2,10,None,,https://pbs.twimg.com/media/CWskEqnWUAAQZW_.jpg,1,maze,0.33985,False,streetcar,0.09968780000000001,False,sundial,0.0848077,False
1429,1936,False,Meet Grizz. He just arrived. Couldn't wait until Christmas. Worried bc he saw the swastikas on the carpet. 10/10 https://t.co/QBGwYrT7rv,678643457146150913,374,False,1499,,,,https://twitter.com/dog_rates/status/678643457146150913/photo/1,10,10,Grizz,,https://pbs.twimg.com/media/CWsGnyMVEAAM1Y1.jpg,1,labrador_retriever,0.33875700000000003,True,flat-coated_retriever,0.30446999999999996,True,chest,0.0933923,False
1430,3766,False,Touching scene here. Really stirs up the emotions. The bond between father &amp; son. So beautiful. 10/10 for both pups https://t.co/AJWJHov5gx,678446151570427904,1426,False,1500,,,,https://twitter.com/dog_rates/status/678446151570427904/photo/1,10,10,None,,https://pbs.twimg.com/media/CWpTLOYWsAEDhcU.jpg,1,staffordshire_bullterrier,0.284492,True,rottweiler,0.189434,True,american_staffordshire_terrier,0.18943,True
1431,5148,False,This is Crystal. She's a shitty fireman. No sense of urgency. People could be dying Crystal. 2/10 just irresponsible https://t.co/rtMtjSl9pz,678424312106393600,2364,False,1501,,,,https://twitter.com/dog_rates/status/678424312106393600/photo/1,2,10,Crystal,,https://pbs.twimg.com/media/CWo_T8gW4AAgJNo.jpg,1,maltese_dog,0.759945,True,toy_poodle,0.101194,True,shih-tzu,0.0560374,True
1432,3961,False,Say hello to Jerome. He can shoot french fries out of his mouth at insane speeds. Deadly af. 10/10 https://t.co/dIy88HwrX8,678410210315247616,1674,False,1502,,,,https://twitter.com/dog_rates/status/678410210315247616/photo/1,10,10,Jerome,,https://pbs.twimg.com/media/CWoyfMiWUAAmGdd.jpg,1,schipperke,0.145877,True,labrador_retriever,0.0983538,True,kelpie,0.09739339999999999,True
1433,75509,False,This made my day. 12/10 please enjoy https://t.co/VRTbo3aAcm,678399652199309312,29518,False,1503,,,,https://twitter.com/dog_rates/status/678399652199309312/video/1,12,10,None,,https://pbs.twimg.com/ext_tw_video_thumb/678399528077250560/pu/img/BOjUNHRsYLeSo0hl.jpg,1,swing,0.9291959999999999,False,bedlington_terrier,0.0150472,True,great_pyrenees,0.014038900000000002,True
1434,1499,False,These little fellas have opposite facial expressions. Both 12/10 https://t.co/LmThv0GWen,678396796259975168,389,False,1504,,,,"https://twitter.com/dog_rates/status/678396796259975168/photo/1,https://twitter.com/dog_rates/status/678396796259975168/photo/1",12,10,None,,https://pbs.twimg.com/media/CWomSU_XIAAUYiK.jpg,2,pembroke,0.9561799999999999,True,cardigan,0.0318031,True,chihuahua,0.0062765,True
1435,1758,False,"This is Bella. She just learned that her final grade in chem was a 92.49 
poor pupper 11/10 https://t.co/auOoKuoveM",678389028614488064,392,False,1505,,,,https://twitter.com/dog_rates/status/678389028614488064/photo/1,11,10,Bella,pupper,https://pbs.twimg.com/media/CWofOHUWUAACGVa.jpg,1,miniature_pinscher,0.516284,True,kelpie,0.227402,True,vizsla,0.103246,True
1436,2299,False,This is Crumpet. He underestimated the snow. Quickly retreating. 10/10 https://t.co/a0Zx5LDFZa,678380236862578688,841,False,1506,,,,https://twitter.com/dog_rates/status/678380236862578688/photo/1,10,10,Crumpet,,https://pbs.twimg.com/media/CWoXOfSUAAA4u8g.jpg,1,dogsled,0.08854,False,snowmobile,0.057290999999999995,False,samoyed,0.0476014,True
1437,1627,False,This pupper likes tape. 12/10 https://t.co/cSp6w5GWgm,678341075375947776,499,False,1507,,,,https://twitter.com/dog_rates/status/678341075375947776/photo/1,12,10,None,pupper,https://pbs.twimg.com/media/CWnznDTU4AAa-6P.jpg,1,golden_retriever,0.853284,True,cocker_spaniel,0.0262298,True,labrador_retriever,0.024122799999999996,True
1438,1221,False,This is Rosie. She has a snazzy bow tie and a fin for a tail. Probably super fast underwater. Cool socks 10/10 https://t.co/GO76MdGBs0,678334497360859136,231,False,1508,,,,https://twitter.com/dog_rates/status/678334497360859136/photo/1,10,10,Rosie,,https://pbs.twimg.com/media/CWntoDVWcAEl3NB.jpg,1,norfolk_terrier,0.378643,True,golden_retriever,0.0955939,True,kelpie,0.0853092,True
1439,10744,False,Another spooky pupper here. Most definitely floating. No legs. Probably knows some dark magic. 10/10 very spooked https://t.co/JK8MByRzgj,678278586130948096,5675,False,1509,,,,https://twitter.com/dog_rates/status/678278586130948096/photo/1,10,10,None,pupper,https://pbs.twimg.com/media/CWm6xySUEAAqfFU.jpg,1,maltese_dog,0.897841,True,lhasa,0.0357175,True,tibetan_terrier,0.017107499999999998,True
1440,1493,False,This is Jessifer. She is a Bismoth Teriyaki. Flowers being attacked by hurricanes on bandana (rad). 9/10 stellar pup https://t.co/nZhmRwZzWv,678255464182861824,342,False,1510,,,,https://twitter.com/dog_rates/status/678255464182861824/photo/1,9,10,Jessifer,,https://pbs.twimg.com/media/CWmlvxJU4AEAqaN.jpg,1,chihuahua,0.613819,True,yorkshire_terrier,0.127931,True,pomeranian,0.062124300000000014,True
1441,12750,False,This is Reese. He likes holding hands. 12/10 https://t.co/cbLroGCbmh,678021115718029313,5836,False,1511,,,,https://twitter.com/dog_rates/status/678021115718029313/photo/1,12,10,Reese,,https://pbs.twimg.com/media/CWjQm5gXAAA9GkD.jpg,1,miniature_pinscher,0.822048,True,doberman,0.0960845,True,rottweiler,0.032709300000000004,True
